{
  "$schema": "https://json-schema.org/draft/2020-12/schema",
  "$id": "https://github.com/Geoffe-Ga/adepthood/backend/content/manifest.schema.json",
  "title": "APTITUDE content manifest",
  "description": "Frozen contract between the aptitude-course content repo (which generates this manifest from per-file YAML frontmatter) and the adepthood backend (which vendors and reads it). Changing this schema post-merge requires a schema_version bump and a note in docs/adr/0001-git-content-pipeline.md (issue #389). schema_version 1.1.0 adds the optional, additive 'stage_intros[]' tier (per-stage course introductions); a 1.0.0 manifest with no 'stage_intros' stays valid. schema_version 1.2.0 adds an optional 'media[]' to site_resource (mirroring chapter.media); resources without it stay valid. schema_version 1.3.0 adds a required integer 'order' (1-based, unique and contiguous upstream) to each site_resource so the app can present the resources as an ordered Start Here reading list (aptitude-course#75, adepthood#3141).",
  "type": "object",
  "additionalProperties": false,
  "required": [
    "schema_version",
    "chapters",
    "site_resources"
  ],
  "properties": {
    "schema_version": {
      "description": "Semver of this contract. Readers must reject manifests with a different major version.",
      "type": "string",
      "pattern": "^\\d+\\.\\d+\\.\\d+$"
    },
    "chapters": {
      "type": "array",
      "items": {
        "$ref": "#/$defs/chapter"
      }
    },
    "site_resources": {
      "description": "Free site resources, mirroring the legacy SITE_RESOURCES table.",
      "type": "array",
      "items": {
        "$ref": "#/$defs/site_resource"
      }
    },
    "stage_intros": {
      "description": "Optional per-stage course introductions (added in schema_version 1.1.0). Ungated and not seeded; the reader serves them straight from the manifest. Omitting this key keeps a 1.0.0 manifest valid.",
      "type": "array",
      "items": {
        "$ref": "#/$defs/stage_intro"
      }
    }
  },
  "$defs": {
    "chapter": {
      "type": "object",
      "additionalProperties": false,
      "required": [
        "id",
        "stage",
        "chapter",
        "slug",
        "title",
        "content_type",
        "release_day",
        "order",
        "path"
      ],
      "properties": {
        "id": {
          "description": "Stable identifier, e.g. 'beige-1'. Never reused or renumbered.",
          "type": "string",
          "minLength": 1
        },
        "stage": {
          "description": "Curriculum stage 1..10 \u2014 identical numbering in both repos (see the ADR's stage-numbering reconciliation).",
          "type": "integer",
          "minimum": 1,
          "maximum": 10
        },
        "chapter": {
          "description": "1-based chapter number within the stage.",
          "type": "integer",
          "minimum": 1
        },
        "slug": {
          "type": "string",
          "minLength": 1
        },
        "title": {
          "type": "string",
          "minLength": 1
        },
        "content_type": {
          "type": "string",
          "enum": [
            "chapter",
            "essay",
            "prompt",
            "video"
          ]
        },
        "release_day": {
          "description": "Days after the stage start when this item drips open (0 = immediately).",
          "type": "integer",
          "minimum": 0
        },
        "order": {
          "description": "Display order within the stage (ascending). Distinct from 'chapter': 'order' may interleave essays/prompts/videos between chapters; ties are resolved by 'chapter' then 'id'.",
          "type": "integer",
          "minimum": 0
        },
        "path": {
          "description": "Markdown path relative to the content repo root, e.g. 'markdown/01-beige/01-survival.md'.",
          "type": "string",
          "minLength": 1
        },
        "summary": {
          "type": "string"
        },
        "media": {
          "type": "array",
          "items": {
            "type": "string",
            "minLength": 1
          }
        }
      }
    },
    "site_resource": {
      "type": "object",
      "additionalProperties": false,
      "required": [
        "order",
        "slug",
        "title",
        "description",
        "path"
      ],
      "properties": {
        "order": {
          "type": "integer",
          "minimum": 1,
          "description": "1-based position in the Start Here reading list (added in schema_version 1.3.0). Upstream derives it from the resource's NN- filename prefix and guarantees it is unique and contiguous across site_resources[]."
        },
        "slug": {
          "type": "string",
          "minLength": 1
        },
        "title": {
          "type": "string",
          "minLength": 1
        },
        "description": {
          "type": "string",
          "description": "Human-readable blurb. Deliberately allowed to be empty (unlike title/slug) \u2014 a resource may not need one."
        },
        "path": {
          "type": "string",
          "minLength": 1
        },
        "media": {
          "description": "Optional asset paths referenced by the resource Markdown (added in schema_version 1.2.0; mirrors chapter.media). Omitting it is valid.",
          "type": "array",
          "items": {
            "type": "string",
            "minLength": 1
          }
        }
      }
    },
    "stage_intro": {
      "type": "object",
      "additionalProperties": false,
      "required": [
        "stage",
        "id",
        "slug",
        "title",
        "path"
      ],
      "properties": {
        "stage": {
          "description": "Curriculum stage 1..10 this introduction belongs to (same numbering as chapters).",
          "type": "integer",
          "minimum": 1,
          "maximum": 10
        },
        "id": {
          "description": "Stable identifier, unique repo-wide, e.g. 'beige-intro'. Never reused or renumbered.",
          "type": "string",
          "minLength": 1
        },
        "slug": {
          "description": "URL-safe slug for the introduction.",
          "type": "string",
          "minLength": 1
        },
        "title": {
          "type": "string",
          "minLength": 1
        },
        "path": {
          "description": "Markdown path relative to the content repo root, e.g. 'markdown/01-beige/00-introduction.md'.",
          "type": "string",
          "minLength": 1
        },
        "summary": {
          "type": "string"
        }
      }
    }
  }
}
